149,FIN6140,Finnegan,0,0,0.0,528.0,"Finnegan, Henderson, Farabow, Garrett & Dunner",155501.0,urn:entity:lfm-155501,https://yoda.lexisai.aws.lexis.com/lawfirms/155501,"Finnegan, Henderson, Farabow, Garrett & Dunner",359.0,230.0,122.0,40.0,26.0,"Arizona, California, Colorado, Delaware, District of Columbia, Florida, Georgia, Illinois, Indiana, Iowa, Kansas, Kentucky, Maryland, Massachusetts, Michigan, Mississippi, Nevada, New Jersey, New York, North Carolina, Pennsylvania, Tennessee, Texas, Virginia, Washington, West Virginia",153.0,0.0,0.0,0.0,0.0,37.0,9.0,0.0,0.0,0.0,0.0,1.0,278.0,0.0,0.0,0.0,0.0,1.0,58.0,11.0,0.0,11.0,0.0,0.0,0.0,0.0,4.0,0.0,8.0,0.0,0.0,121.0,31.0,1.0,0.0,4.0,0.0,7.0,0.0,1.0,1.0,0.0,10.0,0.0,4.0,0.0,0.0,0.0,0.0,0.0,1.0,29.0,4.0,10.0,28.0,0.0,1.0,2.0,0.0,0.0,0.0,0.0,1.0,1.0,0.0,14.0,0.0,1.0,2.0,0.0,0.0,0.0,0.0,1.0,1.0,0.0,0.0,0.0,0.0,0.0,0.0,0.0,4.0,15.0,2.0,12.0,1.0,0.0,0.0,0.0,0.0,1.0,0.0,0.0,0.0,2.0,1.0,1.0,0.0,0.0,0.0,0.0,0.0,0.0,0.0,0.0,0.0,4.0,0.0,2.0,0.0,5.0,1.0,9.0,0,0,0.0,0.0,0.0,0,0.0,0,0,0,0.0,0,0.0,0,0.0,0.0,0,0.0,0,0,0.7451085564237222,0.773015873015873,0.1984126984126984,0.11666666666666667,0.6444444444444445,0.7992063492063493,0.07063492063492063,0.21428571428571427,0.9920634920634921,0.11825396825396825,0.17539682539682538,0.2373015873015873,0.35666666666666663,0.20793650793650795,0.2746031746031746,0.20793650793650795,0.2746031746031746,0.4030555555555555,0.4030555555555555,380.0,40.3
150,FIS7327,Fish & Richardson,0,0,0.0,906.0,Fish & Richardson,139460.0,urn:entity:lfm-139460,https://yoda.lexisai.aws.lexis.com/lawfirms/139460,Fish & Richardson,907.0,145.0,754.0,49.0,34.0,"Arizona, California, Colorado, Connecticut, Delaware, District of Columbia, Florida, Georgia, Illinois, Indiana, Louisiana, Maine, Maryland, Massachusetts, Michigan, Minnesota, Missouri, Nebraska, Nevada, New Jersey, New York, North Carolina, Ohio, Oklahoma, Oregon, Pennsylvania, South Carolina, Tennessee, Texas, Utah, Virginia, Washington, West Virginia, Wisconsin",279.0,1.0,0.0,6.0,0.0,58.0,16.0,2.0,0.0,0.0,0.0,0.0,811.0,2.0,1.0,0.0,0.0,3.0,52.0,18.0,2.0,15.0,0.0,0.0,0.0,1.0,5.0,0.0,46.0,3.0,0.0,213.0,9.0,6.0,0.0,0.0,0.0,4.0,1.0,0.0,1.0,1.0,7.0,0.0,1.0,0.0,1.0,0.0,0.0,0.0,0.0,101.0,33.0,22.0,208.0,0.0,0.0,4.0,1.0,5.0,6.0,1.0,0.0,0.0,1.0,32.0,0.0,0.0,2.0,2.0,6.0,0.0,0.0,0.0,0.0,11.0,1.0,1.0,1.0,0.0,0.0,0.0,2.0,30.0,0.0,49.0,15.0,0.0,0.0,0.0,0.0,1.0,0.0,1.0,0.0,10.0,8.0,0.0,0.0,0.0,1.0,0.0,4.0,0.0,0.0,0.0,0.0,11.0,1.0,8.0,0.0,8.0,0.0,4.0,0,0,0.0,0.0,0.0,0,0.0,0,0,0,0.0,0,0.0,0,0.0,0.0,0,0.0,0,0,0.8297121173306007,0.8444444444444444,0.48968253968253966,0.11666666666666667,0.765079365079365,0.8968253968253969,0.21349206349206348,0.08412698412698413,1.0,0.3904761904761905,0.4253968253968254,0.3738095238095238,0.4755555555555556,0.20793650793650795,0.2746031746031746,0.20793650793650795,0.2746031746031746,0.4506349206349206,0.4506349206349206,324.0,45.1
151,FIS5507,Fisher Phillips,0,0,0.0,37775162.0,Fisher & Phillips,105212.0,urn:entity:lfm-105212,https://yoda.lexisai.aws.lexis.com/lawfirms/105212,Fisher & Phillips,2384.0,168.0,2205.0,85.0,48.0,"Alabama, Alaska, Arizona, Arkansas, California, Colorado, Connecticut, Delaware, District of Columbia, Florida, Georgia, Hawaii, Idaho, Illinois, Indiana, Iowa, Kansas, Kentucky, Louisiana, Maine, Maryland, Massachusetts, Michigan, Minnesota, Mississippi, Missouri, Montana, Nebraska, Nevada, New Hampshire, New Jersey, New Mexico, New York, North Carolina, Ohio, Oklahoma, Oregon, Pennsylvania, Rhode Island, South Carolina, Tennessee, Texas, Utah, Virginia, Washington, West Virginia, Wisconsin, Wyoming",722.0,0.0,0.0,176.0,15.0,171.0,1.0,1740.0,2.0,64.0,8.0,4.0,3.0,4.0,1.0,0.0,0.0,19.0,9.0,86.0,2.0,29.0,2.0,4.0,0.0,12.0,23.0,5.0,61.0,3.0,0.0,2.0,64.0,124.0,18.0,28.0,0.0,22.0,14.0,12.0,49.0,57.0,33.0,9.0,1.0,3.0,24.0,2.0,8.0,10.0,32.0,17.0,40.0,63.0,22.0,9.0,43.0,32.0,5.0,48.0,37.0,17.0,18.0,33.0,5.0,45.0,12.0,8.0,21.0,2.0,6.0,7.0,2.0,0.0,4.0,4.0,10.0,37.0,3.0,0.0,0.0,1.0,27.0,252.0,56.0,76.0,28.0,0.0,1.0,2.0,4.0,61.0,0.0,36.0,7.0,54.0,63.0,47.0,4.0,0.0,6.0,3.0,3.0,2.0,3.0,16.0,3.0,127.0,19.0,129.0,14.0,114.0,10.0,13.0,0,0,0.0,0.0,0.0,0,0.0,0,0,0,0.0,0,0.0,0,0.0,0.0,0,0.0,0,0,0.9932432432432431,0.9920634920634921,0.1984126984126984,0.7404761904761905,0.9476190476190476,0.33095238095238094,0.9952380952380953,0.4,0.48968253968253966,0.49126984126984125,0.4253968253968254,0.6976190476190476,0.5716666666666667,0.20793650793650795,0.2746031746031746,0.20793650793650795,0.2746031746031746,0.5115674603174604,0.5115674603174604,255.0,51.2
152,FIS5443,FisherBroyles,0,0,0.0,720671.0,FisherBroyles,3050262.0,urn:entity:lfm-3050262,https://yoda.lexisai.aws.lexis.com/lawfirms/3050262,FisherBroyles,433.0,123.0,301.0,54.0,34.0,"Alabama, California, Colorado, Delaware, District of Columbia, Florida, Georgia, Illinois, Indiana, Kansas, Kentucky, Louisiana, Maryland, Massachusetts, Michigan, Minnesota, Mississippi, Missouri, Nebraska, Nevada, New Jersey, New York, North Carolina, Ohio, Oklahoma, Oregon, Pennsylvania, South Carolina, Tennessee, Texas, Utah, Virginia, Washington, Wisconsin",290.0,2.0,0.0,19.0,82.0,73.0,7.0,61.0,1.0,9.0,2.0,13.0,39.0,11.0,3.0,2.0,1.0,21.0,34.0,9.0,0.0,5.0,0.0,0.0,0.0,0.0,8.0,0.0,16.0,0.0,0.0,13.0,34.0,33.0,11.0,7.0,0.0,8.0,1.0,1.0,2.0,1.0,3.0,0.0,0.0,0.0,0.0,0.0,3.0,0.0,1.0,3.0,29.0,9.0,21.0,0.0,3.0,2.0,0.0,9.0,16.0,0.0,1.0,1.0,0.0,12.0,0.0,0.0,2.0,3.0,1.0,0.0,0.0,0.0,0.0,5.0,2.0,1.0,1.0,0.0,0.0,0.0,0.0,29.0,3.0,15.0,4.0,0.0,0.0,0.0,0.0,13.0,0.0,2.0,0.0,3.0,10.0,1.0,0.0,0.0,1.0,1.0,2.0,0.0,0.0,1.0,2.0,9.0,0.0,30.0,5.0,22.0,7.0,5.0,FisherBroyles,FisherBroyles,5217.0,268505281.0,2.0,0,0.0,0,0,FisherBroyles,242607.0,"FisherBroyles, LLP",242607.0,"FisherBroyles, LLP",102627877.0,10.0,0,0.0,0,0,0.8632837517612398,0.8698412698412699,0.6277777777777778,0.9119047619047619,0.8301587301587302,0.7587301587301587,0.8357142857142857,0.6246031746031746,0.85,0.6611111111111111,0.6444444444444445,0.7182539682539683,0.7462698412698413,0.6396825396825396,0.6317460317460317,0.6396825396825396,0.6317460317460317,0.7218849206349206,0.7218849206349206,120.0,72.2
153,FIT2993,Fitch Even,0,0,0.0,18105.0,"Fitch, Even, Tabin & Flannery",111501.0,urn:entity:lfm-111501,https://yoda.lexisai.aws.lexis.com/lawfirms/111501,"Fitch, Even, Tabin & Flannery",30.0,21.0,9.0,13.0,9.0,"Alabama, California, Delaware, Florida, Illinois, Iowa, New York, Texas, Virginia",29.0,0.0,0.0,0.0,0.0,10.0,1.0,0.0,0.0,0.0,0.0,0.0,22.0,0.0,0.0,0.0,0.0,0.0,5.0,1.0,0.0,0.0,0.0,0.0,0.0,0.0,2.0,0.0,1.0,2.0,0.0,2.0,0.0,0.0,0.0,0.0,0.0,0.0,0.0,0.0,0.0,0.0,1.0,0.0,0.0,0.0,0.0,0.0,0.0,0.0,0.0,0.0,0.0,1.0,4.0,0.0,0.0,0.0,0.0,0.0,0.0,0.0,0.0,0.0,0.0,9.0,0.0,0.0,0.0,0.0,0.0,0.0,0.0,1.0,0.0,0.0,0.0,0.0,0.0,0.0,0.0,0.0,0.0,3.0,0.0,2.0,0.0,0.0,0.0,0.0,0.0,0.0,0.0,0.0,0.0,0.0,0.0,0.0,0.0,0.0,0.0,0.0,0.0,0.0,0.0,1.0,0.0,0.0,0.0,1.0,0.0,0.0,0.0,0.0,0,0,0.0,0.0,0.0,0,0.0,0,0,0,0.0,0,0.0,0,0.0,0.0,0,0.0,0,0,0.38699244267964644,0.4492063492063492,0.1984126984126984,0.11666666666666667,0.2523809523809524,0.33095238095238094,0.07063492063492063,0.08412698412698413,0.7666666666666667,0.11825396825396825,0.17539682539682538,0.1007936507936508,0.2214285714285714,0.20793650793650795,0.2746031746031746,0.20793650793650795,0.2746031746031746,0.28829365079365077,0.28829365079365077,540.0,28.8
154,FLA5125,Flaster/Greenberg,0,0,0.0,0.0,0,0.0,0,0,Flaster/Greenberg,79.0,31.0,43.0,12.0,10.0,"California, Delaware, Florida, Illinois, Massachusetts, New Jersey, New York, Ohio, Pennsylvania, Texas",59.0,0.0,2.0,1.0,2.0,11.0,3.0,2.0,0.0,2.0,0.0,20.0,15.0,0.0,1.0,0.0,0.0,0.0,14.0,4.0,0.0,1.0,0.0,0.0,0.0,0.0,3.0,0.0,8.0,0.0,0.0,6.0,26.0,20.0,0.0,0.0,0.0,0.0,0.0,0.0,0.0,0.0,0.0,0.0,0.0,0.0,0.0,0.0,0.0,0.0,0.0,0.0,0.0,0.0,1.0,0.0,0.0,0.0,0.0,0.0,1.0,0.0,0.0,0.0,0.0,3.0,0.0,0.0,0.0,0.0,0.0,0.0,0.0,0.0,0.0,0.0,0.0,0.0,0.0,0.0,0.0,0.0,0.0,3.0,0.0,0.0,0.0,0.0,0.0,0.0,0.0,0.0,0.0,0.0,0.0,0.0,0.0,0.0,0.0,0.0,0.0,0.0,0.0,0.0,0.0,0.0,0.0,5.0,0.0,2.0,0.0,0.0,0.0,0.0,0,0,0.0,0.0,0.0,0,0.0,0,0,0,0.0,0,0.0,0,0.0,0.0,0,0.0,0,0,0.43775217753298323,0.5222222222222223,0.1984126984126984,0.37936507936507935,0.2714285714285714,0.5507936507936508,0.21349206349206348,0.7055555555555556,0.7047619047619048,0.11825396825396825,0.4253968253968254,0.1007936507936508,0.36682539682539683,0.20793650793650795,0.2746031746031746,0.20793650793650795,0.2746031746031746,0.3428968253968254,0.3428968253968254,463.0,34.3
155,FOL2461,Foley & Lardner,0,0,0.0,4856.0,Foley & Lardner,128224.0,urn:entity:lfm-128224,https://yoda.lexisai.aws.lexis.com/lawfirms/128224,Foley & Lardner,1060.0,276.0,721.0,72.0,44.0,"Alabama, Arizona, Arkansas, California, Colorado, Connecticut, Delaware, District of Columbia, Florida, Georgia, Guam, Illinois, Indiana, Iowa, Kentucky, Louisiana, Maryland, Massachusetts, Michigan, Minnesota, Mississippi, Missouri, Nebraska, Nevada, New Hampshire, New Jersey, New Mexico, New York, North Carolina, North Dakota, Ohio, Oklahoma, Oregon, Pennsylvania, Rhode Island, South Carolina, Tennessee, Texas, Utah, Virginia, Washington, West Virginia, Wisconsin, Wyoming",469.0,24.0,36.0,25.0,73.0,275.0,25.0,140.0,4.0,19.0,7.0,19.0,145.0,48.0,21.0,3.0,1.0,20.0,82.0,33.0,0.0,24.0,1.0,4.0,1.0,5.0,14.0,1.0,54.0,1.0,0.0,39.0,15.0,11.0,2.0,8.0,0.0,6.0,1.0,1.0,4.0,12.0,19.0,0.0,4.0,0.0,6.0,0.0,3.0,0.0,1.0,35.0,40.0,66.0,41.0,4.0,2.0,64.0,5.0,6.0,10.0,0.0,3.0,0.0,4.0,66.0,2.0,9.0,7.0,29.0,19.0,2.0,0.0,0.0,3.0,8.0,8.0,6.0,1.0,1.0,0.0,0.0,5.0,83.0,6.0,49.0,17.0,1.0,0.0,0.0,0.0,11.0,0.0,2.0,0.0,2.0,16.0,0.0,2.0,1.0,0.0,1.0,35.0,1.0,0.0,5.0,0.0,61.0,10.0,57.0,1.0,5.0,1.0,10.0,Foley & Lardner,Foley & Lardner,940.0,8293358981.0,23.0,0,0.0,0,0,Foley & Lardner,233515.0,Foley & Lardner,233515.0,Foley & Lardner,8891502348.0,79.0,0,0.0,0,0,0.9529989112335083,0.953968253968254,0.9595238095238096,0.9047619047619048,0.9888888888888889,0.953968253968254,0.9301587301587302,0.6928571428571428,0.9714285714285714,0.8873015873015873,0.9103174603174603,0.7071428571428572,0.8906349206349207,0.8571428571428571,0.8841269841269841,0.8571428571428571,0.8841269841269841,0.896468253968254,0.896468253968254,24.0,89.6
156,FOL6060,Foley & Mansfield,0,0,0.0,15692.0,Foley & Mansfield,589057.0,urn:entity:lfm-589057,https://yoda.lexisai.aws.lexis.com/lawfirms/589057,Foley & Mansfield,186.0,13.0,167.0,36.0,23.0,"California, Colorado, District of Columbia, Florida, Illinois, Indiana, Kansas, Kentucky, Louisiana, Michigan, Minnesota, Missouri, Montana, New Jersey, New York, North Dakota, Ohio, Oregon, Pennsylvania, South Dakota, Texas, Virgin Islands, Washington",163.0,0.0,5.0,8.0,3.0,15.0,0.0,28.0,1.0,1.0,0.0,7.0,0.0,92.0,1.0,1.0,0.0,8.0,1.0,4.0,0.0,0.0,0.0,0.0,0.0,0.0,1.0,0.0,3.0,0.0,0.0,0.0,2.0,2.0,0.0,0.0,1.0,0.0,0.0,0.0,0.0,0.0,0.0,0.0,0.0,0.0,20.0,2.0,1.0,0.0,0.0,0.0,1.0,1.0,0.0,0.0,1.0,20.0,7.0,2.0,0.0,0.0,0.0,0.0,1.0,11.0,3.0,0.0,1.0,0.0,0.0,0.0,0.0,0.0,0.0,25.0,6.0,1.0,0.0,2.0,1.0,0.0,0.0,18.0,2.0,15.0,3.0,0.0,0.0,0.0,1.0,0.0,0.0,7.0,1.0,6.0,1.0,1.0,0.0,0.0,0.0,0.0,0.0,0.0,0.0,0.0,0.0,8.0,0.0,7.0,0.0,0.0,0.0,1.0,0,0,0.0,0.0,0.0,0,0.0,0,0,0,0.0,0,0.0,0,0.0,0.0,0,0.0,0,0,0.6446578391187395,0.7,0.1984126984126984,0.45634920634920634,0.33650793650793653,0.1261904761904762,0.6817460317460318,0.5071428571428571,0.1619047619047619,0.946031746031746,0.4253968253968254,0.5325396825396825,0.4372222222222222,0.20793650793650795,0.2746031746031746,0.20793650793650795,0.2746031746031746,0.40494047619047613,0.40494047619047613,374.0,40.5
157,FOL7287,Foley Hoag,0,0,0.0,1910.0,Foley Hoag,301137.0,urn:entity:lfm-301137,https://yoda.lexisai.aws.lexis.com/lawfirms/301137,Foley Hoag,148.0,38.0,104.0,25.0,18.0,"Arkansas, California, Colorado, Connecticut, Delaware, District of Columbia, Florida, Illinois, Louisiana, Massachusetts, Michigan, New Hampshire, New Jersey, New York, Oklahoma, Oregon, Pennsylvania, South Carolina",115.0,0.0,2.0,10.0,4.0,28.0,1.0,3.0,2.0,1.0,1.0,5.0,9.0,2.0,5.0,0.0,0.0,1.0,5.0,10.0,0.0,46.0,1.0,0.0,0.0,2.0,13.0,2.0,35.0,0.0,0.0,2.0,5.0,1.0,0.0,1.0,0.0,0.0,0.0,0.0,0.0,1.0,0.0,0.0,0.0,0.0,0.0,0.0,1.0,0.0,0.0,0.0,0.0,0.0,0.0,0.0,0.0,1.0,0.0,0.0,0.0,0.0,0.0,0.0,0.0,7.0,3.0,0.0,0.0,0.0,0.0,1.0,0.0,0.0,0.0,0.0,0.0,0.0,0.0,0.0,0.0,0.0,0.0,2.0,0.0,6.0,1.0,0.0,0.0,0.0,0.0,0.0,0.0,2.0,0.0,0.0,2.0,0.0,0.0,0.0,0.0,1.0,0.0,0.0,0.0,0.0,0.0,1.0,0.0,4.0,0.0,0.0,0.0,7.0,Foley Hoag,Foley Hoag,941.0,1610475000.0,8.0,0,0.0,0,0,Foley Hoag,233932.0,Foley Hoag,233932.0,Foley Hoag,4388251359.0,17.0,0,0.0,0,0,0.5686123030613552,0.638095238095238,0.1984126984126984,0.5007936507936508,0.5428571428571428,0.33095238095238094,0.25873015873015875,0.4388888888888889,0.6349206349206349,0.3904761904761905,0.7309523809523809,0.2373015873015873,0.42642857142857143,0.7698412698412699,0.8507936507936508,0.7698412698412699,0.8507936507936508,0.6712896825396826,0.6712896825396826,147.0,67.1
158,FOR5804,FordHarrison,0,0,0.0,87952.0,FordHarrison,111730.0,urn:entity:lfm-111730,https://yoda.lexisai.aws.lexis.com/lawfirms/111730,FordHarrison,1244.0,76.0,1143.0,66.0,36.0,"Alabama, Arizona, Arkansas, California, Colorado, Connecticut, District of Columbia, Florida, Georgia, Hawaii, Illinois, Indiana, Iowa, Kansas, Kentucky, Louisiana, Maryland, Massachusetts, Minnesota, Mississippi, Missouri, Nebraska, Nevada, New Jersey, New Mexico, New York, North Carolina, Ohio, Oklahoma, Pennsylvania, Rhode Island, South Carolina, Tennessee, Texas, Utah, Virginia",435.0,0.0,0.0,107.0,17.0,70.0,9.0,912.0,0.0,37.0,2.0,3.0,1.0,0.0,1.0,1.0,0.0,7.0,6.0,35.0,0.0,7.0,0.0,3.0,0.0,35.0,19.0,0.0,44.0,1.0,0.0,0.0,45.0,19.0,3.0,2.0,0.0,24.0,16.0,2.0,17.0,48.0,11.0,4.0,0.0,0.0,1.0,0.0,1.0,7.0,2.0,9.0,25.0,6.0,12.0,2.0,5.0,0.0,0.0,1.0,1.0,14.0,36.0,27.0,3.0,34.0,14.0,1.0,4.0,0.0,0.0,7.0,0.0,1.0,0.0,4.0,9.0,7.0,2.0,0.0,0.0,0.0,2.0,79.0,10.0,21.0,18.0,0.0,1.0,0.0,0.0,3.0,0.0,0.0,0.0,0.0,2.0,5.0,1.0,2.0,0.0,2.0,1.0,0.0,6.0,25.0,1.0,241.0,34.0,144.0,14.0,75.0,11.0,11.0,0,0,0.0,0.0,0.0,0,0.0,0,0,0,0.0,0,0.0,0,0.0,0.0,0,0.0,0,0,0.8936291148968873,0.8968253968253969,0.1984126984126984,0.7571428571428571,0.819047619047619,0.7992063492063493,0.9920634920634921,0.35555555555555557,0.36587301587301585,0.11825396825396825,0.4253968253968254,0.5047619047619047,0.5335714285714286,0.20793650793650795,0.2746031746031746,0.20793650793650795,0.2746031746031746,0.47823412698412704,0.47823412698412704,295.0,47.8
159,FOS9990,Foster Garvey,0,0,0.0,0.0,0,0.0,0,0,Foster Garvey,123.0,36.0,83.0,21.0,16.0,"Alaska, Arizona, California, Colorado, Delaware, Florida, Hawaii, Massachusetts, Minnesota, Montana, New York, North Carolina, Oklahoma, Oregon, Virginia, Washington",56.0,1.0,3.0,9.0,3.0,23.0,3.0,7.0,3.0,2.0,0.0,11.0,7.0,1.0,2.0,0.0,0.0,4.0,12.0,6.0,0.0,1.0,0.0,0.0,0.0,0.0,4.0,1.0,17.0,0.0,0.0,1.0,0.0,0.0,0.0,0.0,0.0,0.0,1.0,0.0,0.0,0.0,0.0,1.0,0.0,0.0,0.0,0.0,0.0,0.0,0.0,0.0,0.0,0.0,0.0,0.0,0.0,0.0,0.0,0.0,0.0,0.0,0.0,0.0,0.0,0.0,0.0,0.0,0.0,0.0,0.0,0.0,0.0,0.0,0.0,1.0,0.0,0.0,0.0,0.0,0.0,1.0,1.0,1.0,4.0,1.0,0.0,0.0,1.0,0.0,2.0,0.0,0.0,13.0,11.0,58.0,1.0,0.0,0.0,0.0,1.0,0.0,0.0,0.0,0.0,0.0,0.0,0.0,0.0,1.0,0.0,0.0,0.0,0.0,0,0,0.0,0.0,0.0,0,0.0,0,0,0,0.0,0,0.0,0,0.0,0.0,0,0.0,0,0,0.3746117266555654,0.42857142857142855,0.48968253968253966,0.45634920634920634,0.4785714285714286,0.5507936507936508,0.3738095238095238,0.5968253968253968,0.6055555555555555,0.29603174603174603,0.5571428571428572,0.41904761904761906,0.48238095238095247,0.20793650793650795,0.2746031746031746,0.20793650793650795,0.2746031746031746,0.34837301587301583,0.34837301587301583,454.0,34.8
160,FOW8015,Fowler White Burnett,0,0,0.0,0.0,0,0.0,0,0,Fowler White Burnett,336.0,63.0,261.0,8.0,5.0,"Florida, Hawaii, Minnesota, New Jersey, New York",56.0,0.0,1.0,14.0,6.0,18.0,1.0,13.0,0.0,1.0,0.0,74.0,4.0,12.0,2.0,0.0,1.0,73.0,5.0,1.0,0.0,0.0,0.0,0.0,1.0,0.0,1.0,0.0,0.0,0.0,0.0,0.0,1.0,0.0,0.0,0.0,0.0,0.0,0.0,0.0,0.0,0.0,0.0,0.0,0.0,0.0,0.0,0.0,0.0,0.0,0.0,0.0,0.0,0.0,0.0,0.0,0.0,0.0,0.0,0.0,0.0,0.0,0.0,0.0,0.0,0.0,0.0,0.0,0.0,0.0,0.0,0.0,0.0,0.0,0.0,2.0,0.0,0.0,0.0,0.0,0.0,0.0,0.0,0.0,0.0,0.0,0.0,0.0,1.0,0.0,0.0,0.0,0.0,0.0,0.0,0.0,0.0,0.0,0.0,0.0,0.0,0.0,0.0,0.0,0.0,0.0,0.0,54.0,29.0,247.0,0.0,0.0,0.0,0.0,0,0,0.0,0.0,0.0,0,0.0,0,0,0,0.0,0,0.0,0,0.0,0.0,0,0.0,0,0,0.18007076982195466,0.19206349206349208,0.1984126984126984,0.5626984126984127,0.4087301587301587,0.33095238095238094,0.4865079365079365,0.8825396825396825,0.5238095238095238,0.676984126984127,0.5571428571428572,0.8976190476190476,0.5525396825396826,0.20793650793650795,0.2746031746031746,0.20793650793650795,0.2746031746031746,0.30678571428571433,0.30678571428571433,513.0,30.7
161,FOX8115,Fox Rothschild,0,0,0.0,15810286.0,Fox Rothschild,887316.0,urn:entity:lfm-887316,https://yoda.lexisai.aws.lexis.com/lawfirms/887316,Fox Rothschild,1728.0,466.0,1189.0,75.0,44.0,"Alabama, Alaska, Arizona, Arkansas, California, Colorado, Connecticut, Delaware, District of Columbia, Florida, Georgia, Hawaii, Idaho, Illinois, Indiana, Iowa, Kansas, Kentucky, Louisiana, Maryland, Massachusetts, Michigan, Minnesota, Missouri, Nevada, New Jersey, New Mexico, New York, North Carolina, North Dakota, Ohio, Oklahoma, Oregon, Pennsylvania, Rhode Island, South Carolina, Tennessee, Texas, Utah, Virginia, Washington, West Virginia, Wisconsin, Wyoming",574.0,21.0,59.0,112.0,60.0,403.0,51.0,238.0,5.0,71.0,6.0,107.0,46.0,65.0,13.0,8.0,2.0,59.0,138.0,63.0,0.0,7.0,0.0,1.0,1.0,3.0,50.0,6.0,170.0,3.0,0.0,43.0,159.0,216.0,21.0,23.0,0.0,17.0,62.0,44.0,16.0,37.0,23.0,2.0,1.0,2.0,0.0,0.0,2.0,0.0,0.0,18.0,33.0,25.0,26.0,2.0,0.0,9.0,2.0,9.0,7.0,2.0,4.0,3.0,2.0,53.0,2.0,3.0,2.0,1.0,2.0,1.0,0.0,0.0,4.0,39.0,6.0,7.0,0.0,2.0,0.0,1.0,11.0,93.0,16.0,33.0,9.0,0.0,3.0,1.0,0.0,35.0,0.0,4.0,9.0,59.0,26.0,2.0,7.0,2.0,0.0,4.0,3.0,2.0,0.0,2.0,0.0,53.0,6.0,101.0,13.0,48.0,3.0,9.0,Fox Rothschild,Fox Rothschild,955.0,3007350000.0,14.0,0,0.0,0,0,Fox Rothschild,234462.0,Fox Rothschild,234462.0,Fox Rothschild,858344147.0,36.0,0,0.0,0,0,0.9510295247854488,0.9492063492063492,0.95,0.8825396825396825,0.9984126984126984,0.9841269841269841,0.9666666666666667,0.9253968253968254,0.8698412698412699,0.919047619047619,0.8682539682539683,0.876984126984127,0.9241269841269842,0.8031746031746032,0.7444444444444445,0.8031746031746032,0.7444444444444445,0.8552380952380954,0.8552380952380954,44.0,85.5
162,FRA8329,Fragomen,0,0,0.0,141893326.0,"Fragomen, Del Rey, Bernsen & Loewy",39453.0,urn:entity:lfm-39453,https://yoda.lexisai.aws.lexis.com/lawfirms/39453,"Fragomen, Del Rey, Bernsen & Loewy",84.0,80.0,2.0,18.0,13.0,"Arizona, California, Connecticut, District of Columbia, Missouri, Nevada, New Jersey, New York, Ohio, Pennsylvania, Texas, Virginia, Washington",61.0,0.0,0.0,0.0,0.0,0.0,0.0,0.0,0.0,0.0,0.0,0.0,0.0,0.0,0.0,0.0,0.0,0.0,0.0,0.0,0.0,0.0,0.0,0.0,0.0,2.0,1.0,0.0,4.0,0.0,0.0,0.0,6.0,2.0,0.0,0.0,0.0,0.0,0.0,0.0,0.0,0.0,1.0,0.0,0.0,0.0,0.0,0.0,0.0,0.0,0.0,1.0,4.0,0.0,0.0,0.0,0.0,0.0,0.0,0.0,1.0,0.0,0.0,0.0,0.0,0.0,0.0,0.0,0.0,0.0,0.0,0.0,0.0,0.0,0.0,0.0,0.0,2.0,0.0,0.0,0.0,0.0,2.0,4.0,1.0,12.0,2.0,0.0,0.0,0.0,0.0,1.0,0.0,0.0,0.0,2.0,0.0,0.0,0.0,0.0,0.0,0.0,0.0,0.0,0.0,0.0,0.0,0.0,0.0,0.0,0.0,0.0,0.0,36.0,0,0,0.0,0.0,0.0,0,0.0,0,0,0,0.0,0,0.0,0,0.0,0.0,0,0.0,0,0,0.4133590047393365,0.49206349206349204,0.1984126984126984,0.11666666666666667,0.03253968253968254,0.1261904761904762,0.07063492063492063,0.08412698412698413,0.1619047619047619,0.11825396825396825,0.17539682539682538,0.1007936507936508,0.1184920634920635,0.20793650793650795,0.2746031746031746,0.20793650793650795,0.2746031746031746,0.27327380952380953,0.27327380952380953,557.0,27.3
163,FRA5849,Frankfurt Kurnit Klein & Selz,0,0,0.0,0.0,0,0.0,0,0,Frankfurt Kurnit Klein & Selz,72.0,21.0,47.0,14.0,10.0,"Alabama, California, Louisiana, Mississippi, New Jersey, New Mexico, New York, Oregon, Texas, Virginia",54.0,0.0,0.0,6.0,1.0,17.0,18.0,3.0,0.0,0.0,1.0,0.0,0.0,0.0,0.0,0.0,0.0,3.0,16.0,2.0,0.0,0.0,0.0,0.0,0.0,0.0,2.0,0.0,30.0,0.0,0.0,0.0,1.0,0.0,0.0,0.0,0.0,0.0,0.0,0.0,0.0,0.0,1.0,0.0,0.0,0.0,1.0,0.0,0.0,0.0,1.0,2.0,1.0,0.0,0.0,0.0,0.0,0.0,0.0,0.0,0.0,0.0,0.0,0.0,0.0,0.0,0.0,0.0,0.0,0.0,0.0,0.0,0.0,0.0,0.0,0.0,0.0,0.0,0.0,0.0,0.0,0.0,0.0,23.0,0.0,3.0,3.0,0.0,0.0,0.0,0.0,0.0,0.0,2.0,0.0,0.0,0.0,0.0,1.0,0.0,0.0,0.0,0.0,0.0,0.0,1.0,0.0,0.0,0.0,0.0,0.0,0.0,0.0,0.0,0,0,0.0,0.0,0.0,0,0.0,0,0,0,0.0,0,0.0,0,0.0,0.0,0,0.0,0,0,0.3226591520430383,0.3746031746031746,0.1984126984126984,0.28174603174603174,0.3873015873015873,0.919047619047619,0.25873015873015875,0.08412698412698413,0.1619047619047619,0.11825396825396825,0.17539682539682538,0.3738095238095238,0.29587301587301584,0.20793650793650795,0.2746031746031746,0.20793650793650795,0.2746031746031746,0.28825396825396826,0.28825396825396826,541.0,28.8
164,FRA3737,Franklin & Prokopik,0,0,0.0,0.0,0,0.0,0,0,Franklin & Prokopik,208.0,13.0,190.0,10.0,8.0,"Delaware, District of Columbia, Maryland, New Jersey, Ohio, Pennsylvania, Virginia, West Virginia",60.0,1.0,1.0,3.0,2.0,15.0,0.0,5.0,0.0,0.0,0.0,22.0,0.0,14.0,0.0,1.0,0.0,128.0,1.0,0.0,0.0,0.0,0.0,0.0,0.0,0.0,0.0,0.0,0.0,0.0,0.0,12.0,1.0,0.0,0.0,1.0,0.0,135.0,0.0,0.0,0.0,0.0,24.0,14.0,4.0,2.0,0.0,0.0,0.0,0.0,0.0,0.0,0.0,0.0,0.0,0.0,0.0,0.0,0.0,3.0,0.0,0.0,0.0,0.0,0.0,0.0,0.0,0.0,0.0,0.0,0.0,0.0,0.0,0.0,0.0,0.0,0.0,0.0,0.0,0.0,0.0,0.0,0.0,0.0,0.0,0.0,0.0,0.0,0.0,0.0,0.0,0.0,0.0,0.0,0.0,0.0,0.0,0.0,0.0,0.0,0.0,0.0,0.0,0.0,0.0,0.0,0.0,0.0,0.0,0.0,0.0,0.0,0.0,12.0,0,0,0.0,0.0,0.0,0,0.0,0,0,0,0.0,0,0.0,0,0.0,0.0,0,0.0,0,0,0.13308569232739845,0.1365079365079365,0.48968253968253966,0.37936507936507935,0.33650793650793653,0.1261904761904762,0.32063492063492066,0.7238095238095238,0.1619047619047619,0.7142857142857143,0.17539682539682538,0.9476190476190476,0.4375396825396825,0.20793650793650795,0.2746031746031746,0.20793650793650795,0.2746031746031746,0.26414682539682544,0.26414682539682544,574.0,26.4
165,FRA7996,Frantz Ward,0,0,0.0,16092.0,Frantz Ward,1150440.0,urn:entity:lfm-1150440,https://yoda.lexisai.aws.lexis.com/lawfirms/1150440,Frantz Ward,167.0,36.0,127.0,25.0,20.0,"Arizona, California, Colorado, District of Columbia, Florida, Illinois, Indiana, Kansas, Kentucky, Louisiana, Michigan, Missouri, Nevada, New York, Ohio, Pennsylvania, Texas, Virginia, West Virginia, Wisconsin",60.0,0.0,0.0,1.0,2.0,31.0,0.0,37.0,0.0,26.0,0.0,22.0,1.0,13.0,2.0,8.0,0.0,5.0,0.0,8.0,0.0,0.0,0.0,0.0,0.0,0.0,0.0,1.0,1.0,1.0,0.0,0.0,0.0,0.0,1.0,3.0,0.0,0.0,0.0,0.0,0.0,0.0,0.0,1.0,0.0,1.0,1.0,0.0,0.0,0.0,0.0,0.0,0.0,1.0,0.0,0.0,1.0,2.0,1.0,97.0,43.0,0.0,0.0,0.0,0.0,0.0,1.0,0.0,2.0,1.0,0.0,0.0,0.0,0.0,0.0,0.0,0.0,1.0,0.0,0.0,0.0,0.0,1.0,0.0,0.0,1.0,0.0,0.0,0.0,0.0,0.0,1.0,0.0,0.0,0.0,0.0,1.0,1.0,0.0,0.0,0.0,0.0,0.0,0.0,0.0,0.0,0.0,1.0,0.0,0.0,0.0,0.0,0.0,1.0,0,0,0.0,0.0,0.0,0,0.0,0,0,0,0.0,0,0.0,0,0.0,0.0,0,0.0,0,0,0.3777379275009606,0.43174603174603177,0.1984126984126984,0.37936507936507935,0.5753968253968254,0.1261904761904762,0.7428571428571429,0.7238095238095238,0.36587301587301585,0.6936507936507936,0.5571428571428572,0.45396825396825397,0.48166666666666663,0.20793650793650795,0.2746031746031746,0.20793650793650795,0.2746031746031746,0.34898809523809526,0.34898809523809526,451.0,34.9
166,FRE6083,Fredrikson & Byron,0,0,0.0,8970.0,Fredrikson & Byron,289931.0,urn:entity:lfm-289931,https://yoda.lexisai.aws.lexis.com/lawfirms/289931,Fredrikson & Byron,208.0,57.0,142.0,34.0,25.0,"Arizona, California, Connecticut, Delaware, District of Columbia, Florida, Hawaii, Illinois, Iowa, Kansas, Minnesota, Missouri, Nebraska, New York, North Carolina, North Dakota, Ohio, Oklahoma, Oregon, Pennsylvania, South Dakota, Tennessee, Texas, Virginia, Wisconsin",87.0,2.0,2.0,7.0,2.0,60.0,4.0,32.0,2.0,3.0,3.0,7.0,12.0,7.0,2.0,1.0,1.0,15.0,15.0,18.0,0.0,0.0,0.0,0.0,0.0,1.0,1.0,0.0,7.0,0.0,0.0,1.0,0.0,1.0,0.0,0.0,0.0,0.0,0.0,1.0,0.0,0.0,1.0,0.0,0.0,0.0,0.0,0.0,0.0,0.0,0.0,0.0,1.0,0.0,2.0,0.0,0.0,0.0,0.0,2.0,3.0,0.0,3.0,0.0,0.0,9.0,0.0,0.0,0.0,0.0,8.0,0.0,0.0,3.0,17.0,96.0,1.0,1.0,1.0,24.0,1.0,0.0,2.0,4.0,1.0,1.0,0.0,0.0,1.0,0.0,0.0,0.0,0.0,1.0,0.0,0.0,0.0,1.0,0.0,1.0,1.0,0.0,0.0,0.0,0.0,0.0,0.0,8.0,0.0,1.0,0.0,0.0,0.0,1.0,Fredrikson & Byron,Fredrikson & Byron,968.0,782400000.0,5.0,0,0.0,0,0,Fredrikson & Byron,203460.0,Fredrikson & Byron,203460.0,Fredrikson & Byron,111250000.0,14.0,0,0.0,0,0,0.5864808825413091,0.6571428571428571,0.6277777777777778,0.37936507936507935,0.7785714285714286,0.6246031746031746,0.7063492063492064,0.5071428571428571,0.6746031746031746,0.5793650793650794,0.5571428571428572,0.6547619047619048,0.6089682539682539,0.7285714285714285,0.6349206349206349,0.7285714285714285,0.6349206349206349,0.6574007936507936,0.6574007936507936,153.0,65.7
167,FRE4982,Freeborn & Peters,0,0,0.0,0.0,0,0.0,0,0,Freeborn & Peters,285.0,59.0,217.0,36.0,23.0,"Alabama, Arizona, Arkansas, California, Colorado, Delaware, Florida, Georgia, Illinois, Indiana, Louisiana, Michigan, Minnesota, Missouri, Nevada, New Jersey, New York, North Carolina, Ohio, Pennsylvania, Texas, Virginia, Wisconsin",160.0,6.0,3.0,4.0,13.0,32.0,4.0,12.0,2.0,7.0,1.0,115.0,29.0,1.0,3.0,1.0,0.0,5.0,12.0,12.0,0.0,0.0,0.0,0.0,0.0,0.0,7.0,0.0,12.0,0.0,0.0,7.0,3.0,2.0,0.0,1.0,0.0,0.0,1.0,0.0,0.0,0.0,19.0,5.0,0.0,0.0,11.0,1.0,3.0,0.0,0.0,7.0,1.0,5.0,11.0,0.0,0.0,2.0,0.0,2.0,0.0,0.0,0.0,0.0,0.0,63.0,0.0,2.0,0.0,3.0,1.0,1.0,0.0,0.0,0.0,2.0,1.0,0.0,0.0,0.0,0.0,0.0,2.0,5.0,0.0,3.0,1.0,0.0,0.0,0.0,0.0,3.0,0.0,0.0,0.0,0.0,1.0,0.0,0.0,0.0,0.0,0.0,0.0,0.0,0.0,1.0,0.0,18.0,28.0,48.0,0.0,2.0,0.0,0.0,Freeborn & Peters,Freeborn & Peters,5199.0,52000000.0,1.0,0,0.0,0,0,0,0.0,0,0.0,0,0.0,0.0,0,0.0,0,0,0.7226327334443448,0.7571428571428571,0.8015873015873016,0.7150793650793651,0.5904761904761905,0.6246031746031746,0.46746031746031746,0.9317460317460318,0.8071428571428572,0.29603174603174603,0.6444444444444445,0.45396825396825397,0.6332539682539683,0.5396825396825397,0.2746031746031746,0.5396825396825397,0.2746031746031746,0.5511706349206349,0.5511706349206349,222.0,55.1
